{
  "schema": "specnav.verification.root-cause-review.v1",
  "id": "root-cause-review-minimal",
  "failure_id": "failure-minimal",
  "root_failure_digest": "6a0cdf6ac630a88cf85c073967cafaaa7bc22078fb00aa5e77cb227ff1c8a02a",
  "change_id": "change-v2",
  "run_id": "run-minimal",
  "case_id": "case-minimal",
  "attempt_id": "attempt-minimal",
  "classification": "product_defect",
  "summary": "The deterministic assertion failed.",
  "root_cause": "The product returned an unexpected value.",
  "failed_assertion_ids": [
    "assertion-1"
  ],
  "reviewer": {
    "id": "reviewer-root-cause",
    "kind": "human"
  },
  "decision": "approved",
  "reviewed_at": "2026-08-06T08:00:00Z"
}
